{
  "company": "Example Manufacturing Co., Ltd.",
  "ticker": "EXM",
  "reporting_period": "2025",
  "currency": "USD",
  "schema": {
    "profile": "CAS_2019",
    "standard": "Chinese Accounting Standards for Business Enterprises",
    "presentation_standard": "2019 consolidated financial statement format",
    "statement_type": "income_statement",
    "statement_scope": "consolidated",
    "jurisdiction": "China",
    "monetary_unit": "USD",
    "amount_scale": "1",
    "expense_analysis": "function"
  },
  "source": {
    "statement": "Consolidated income statement",
    "period_start": "2025-01-01",
    "period_end": "2025-12-31",
    "report": "Example Manufacturing 2025 illustrative annual report",
    "url": "https://example.com/reports/example-manufacturing-2025"
  },
  "sections": {
    "operating": [
      {"name": "Operating revenue", "amount": 1800, "source_field": "Revenue", "description": "Illustrative revenue from manufactured goods."},
      {"name": "Cost of revenue", "amount": 1080, "source_field": "Cost of sales", "description": "Illustrative manufacturing cost of goods sold.", "is_deduction": true},
      {"name": "Operating profit", "amount": 720, "source_field": "Operating profit", "description": "Illustrative reported operating profit.", "is_subtotal": true}
    ],
    "profit_and_tax": [
      {"name": "Profit before tax", "amount": 720, "source_field": "Profit before income tax", "description": "Illustrative profit before tax.", "is_subtotal": true},
      {"name": "Income tax expense", "amount": 144, "source_field": "Income tax expense", "description": "Illustrative current and deferred income tax.", "is_deduction": true},
      {"name": "Net profit", "amount": 576, "source_field": "Net profit", "description": "Illustrative profit after tax.", "is_subtotal": true}
    ],
    "attribution": [
      {"name": "Net profit attributable to owners of parent", "amount": 576, "source_field": "Profit attributable to owners", "description": "Illustrative profit attributable to parent shareholders.", "is_subtotal": true}
    ],
    "other_comprehensive_income": [
      {"name": "Total comprehensive income", "amount": 576, "source_field": "Total comprehensive income", "description": "Illustrative comprehensive income with no separate OCI movement.", "is_subtotal": true}
    ],
    "earnings_per_share": [
      {"name": "Basic earnings per share", "amount": "0.576", "source_field": "Basic earnings per share", "description": "Illustrative basic earnings per ordinary share."}
    ]
  }
}
